{
  "$schema": "https://json-schema.org/draft/2020-12/schema",
  "$id": "https://raw.githubusercontent.com/MeowLove/WISK/main/schema/catalog.schema.json",
  "title": "WISK public catalog",
  "type": "object",
  "additionalProperties": false,
  "required": [
    "$schema",
    "schemaVersion",
    "catalogVersion",
    "updatedAt",
    "publisher",
    "repositories",
    "applications",
    "stores"
  ],
  "properties": {
    "$schema": { "type": "string", "format": "uri-reference" },
    "schemaVersion": { "const": 1 },
    "catalogVersion": { "type": "string", "pattern": "^[0-9]+\\.[0-9]+\\.[0-9]+$" },
    "updatedAt": { "type": "string", "format": "date" },
    "publisher": { "$ref": "#/$defs/publisher" },
    "repositories": {
      "type": "array",
      "items": { "$ref": "#/$defs/repository" },
      "minItems": 1
    },
    "applications": {
      "type": "array",
      "items": { "$ref": "#/$defs/application" },
      "minItems": 1
    },
    "stores": { "$ref": "#/$defs/stores" }
  },
  "$defs": {
    "id": {
      "type": "string",
      "pattern": "^[a-z0-9]+(?:-[a-z0-9]+)*$"
    },
    "publisher": {
      "type": "object",
      "additionalProperties": false,
      "required": ["id", "name", "website"],
      "properties": {
        "id": { "$ref": "#/$defs/id" },
        "name": { "type": "string", "minLength": 1 },
        "website": { "type": "string", "format": "uri" }
      }
    },
    "repository": {
      "type": "object",
      "additionalProperties": false,
      "required": ["id", "name", "kind", "visibility", "url", "license"],
      "properties": {
        "id": { "$ref": "#/$defs/id" },
        "name": { "type": "string", "minLength": 1 },
        "kind": { "enum": ["catalog", "application", "data"] },
        "visibility": { "const": "public" },
        "url": { "type": "string", "format": "uri" },
        "license": { "type": "string", "minLength": 1 }
      }
    },
    "application": {
      "type": "object",
      "additionalProperties": false,
      "required": [
        "id",
        "name",
        "description",
        "status",
        "version",
        "repositoryId",
        "releasePage",
        "platforms",
        "runtimeRequirements",
        "storeEntries",
        "tags"
      ],
      "properties": {
        "id": { "$ref": "#/$defs/id" },
        "name": { "type": "string", "minLength": 1 },
        "description": { "type": "string", "minLength": 1 },
        "status": { "enum": ["preview", "stable", "retired"] },
        "version": { "type": "string", "pattern": "^[0-9]+\\.[0-9]+\\.[0-9]+$" },
        "repositoryId": { "$ref": "#/$defs/id" },
        "releasePage": { "type": "string", "format": "uri" },
        "platforms": {
          "type": "array",
          "minItems": 1,
          "items": { "$ref": "#/$defs/platform" }
        },
        "runtimeRequirements": {
          "type": "array",
          "items": { "type": "string", "minLength": 1 }
        },
        "storeEntries": {
          "type": "object",
          "additionalProperties": false,
          "required": ["software", "settings"],
          "properties": {
            "software": { "type": "boolean" },
            "settings": { "type": "boolean" }
          }
        },
        "tags": {
          "type": "array",
          "items": { "type": "string", "minLength": 1 },
          "uniqueItems": true
        }
      }
    },
    "platform": {
      "type": "object",
      "additionalProperties": false,
      "required": ["os", "architecture", "runtime", "distribution"],
      "properties": {
        "os": { "type": "string", "minLength": 1 },
        "architecture": { "type": "string", "minLength": 1 },
        "runtime": { "type": "string", "minLength": 1 },
        "distribution": { "type": "string", "minLength": 1 }
      }
    },
    "storeEntry": {
      "type": "object",
      "additionalProperties": false,
      "required": ["applicationId", "enabled", "order"],
      "properties": {
        "applicationId": { "$ref": "#/$defs/id" },
        "enabled": { "type": "boolean" },
        "order": { "type": "integer", "minimum": 0 },
        "categories": {
          "type": "array",
          "items": { "type": "string", "minLength": 1 },
          "uniqueItems": true
        }
      }
    },
    "stores": {
      "type": "object",
      "additionalProperties": false,
      "required": ["software", "settings"],
      "properties": {
        "software": {
          "type": "array",
          "items": { "$ref": "#/$defs/storeEntry" }
        },
        "settings": {
          "type": "array",
          "items": { "$ref": "#/$defs/storeEntry" }
        }
      }
    }
  }
}

