{
  "$schema": "../schema/catalog.schema.json",
  "schemaVersion": 1,
  "catalogVersion": "3.1.0",
  "updatedAt": "2026-10-13",
  "publisher": {
    "id": "meowlove",
    "name": "MeowLove",
    "website": "https://github.com/MeowLove"
  },
  "repositories": [
    {
      "id": "wisk",
      "name": "WISK",
      "kind": "application",
      "visibility": "public",
      "url": "https://github.com/MeowLove/WISK",
      "license": "GPL-3.0"
    }
  ],
  "applications": [
    {
      "id": "wisk",
      "name": "WISK",
      "description": "WISK 3.1 Windows 11 initialization and configuration workspace with auditable plans, software actions, registry-backed settings, and plugin management.",
      "status": "preview",
      "version": "3.1.0",
      "repositoryId": "wisk",
      "releasePage": "https://github.com/MeowLove/WISK/releases",
      "platforms": [
        {
          "os": "windows",
          "architecture": "x64",
          "runtime": ".NET 10 Windows Desktop Runtime",
          "distribution": "framework-dependent-single-file"
        }
      ],
      "runtimeRequirements": [
        ".NET 10 Windows Desktop Runtime x64"
      ],
      "storeEntries": {
        "software": true,
        "settings": true
      },
      "tags": [
        "windows",
        "initializer",
        "configuration",
        "desktop",
        "explorer",
        "privacy"
      ]
    }
  ],
  "stores": {
    "software": [
      {
        "applicationId": "wisk",
        "enabled": true,
        "order": 100
      }
    ],
    "settings": [
      {
        "applicationId": "wisk",
        "enabled": true,
        "order": 100,
        "categories": [
          "desktop",
          "explorer",
          "privacy",
          "registry"
        ]
      }
    ]
  }
}
